{
  "identity": {
    "canonical_name_zh": "木制棒球棒",
    "canonical_name_en": "wooden baseball bat",
    "display_name_zh": "木制棒球棒",
    "display_name_en": "Wooden Baseball Bat",
    "category": "tool",
    "required_identity_parts": [
      "tapered handle",
      "cylindrical barrel body",
      "knob end",
      "gradually widening bat shape"
    ],
    "material_hints": [
      "wood"
    ],
    "silhouette_hints": [
      "long tapered cylinder that widens from a narrow handle to a thicker barrel end"
    ],
    "optional_decorations": [
      "engraved wood grain",
      "brand stamp near handle"
    ]
  },
  "combat": {
    "behavior_family": "heavy_melee",
    "delivery": "melee_swing",
    "impact_mode": "whole_body_collision",
    "effect_type": "normal",
    "drawback": "long_recovery",
    "cadence_hint": "slow_heavy"
  },
  "visual": {
    "prompt_en": "A wooden baseball bat, full object visible, side view, isolated on plain background, smooth tapered wooden shaft narrowing to a gripped handle with a round knob end, gradually widening into a thicker cylindrical barrel at the striking end, natural wood grain texture, single cohesive object, realistic proportions",
    "negative_prompt_en": "not a sword, not a club with spikes, not a bat with metal barrel, not a gun, no attached blades, no armor plating, not a hammer",
    "must_preserve": [
      "tapered handle",
      "cylindrical barrel body",
      "knob end",
      "gradually widening bat shape"
    ],
    "must_not_replace_with": [
      "sword",
      "hammer",
      "metal bat",
      "gun",
      "spiked club"
    ]
  },
  "confidence": 0.9,
  "affordance": {
    "handle_length": "medium",
    "body_length": "medium",
    "grip_topology": "two_hand_handle",
    "rigidity": "rigid",
    "mass_distribution": "front",
    "contact_surface": "broad",
    "secondary_contact_surface": "none",
    "has_point": false,
    "has_edge": false,
    "has_broad_face": true,
    "has_barrel": true,
    "has_stock": false,
    "confidence": 0.9,
    "evidence_parts": [
      "tapered narrow handle for two-hand grip",
      "knob end to prevent slipping",
      "thick cylindrical barrel for impact",
      "wood construction giving rigidity"
    ]
  }
}
